{
	"id": "2d7c8e5a",
	"attribution": [
		{
			"catalog": [
				{
					"scheme": "bwv",
					"number": "868"
				}
			],
			"composer": "bach",
			"dates": {
				"composed": 1722
			}
		}
	],
	"form": "prelude and fugue",
	"instrumentation": "keyboard",
	"key": "B",
	"movements": [
		{
			"title": "Prelude"
		},
		{
			"title": "Fugue"
		}
	],
	"xref": {
		"oo": "9781",
		"wp": "BWV_868",
		"mb": "4f5a74d0-d183-37f1-b07a-913652e82667"
	}
}
