{
	"id": "b5e7ec76",
	"attribution": [
		{
			"composer": "haydn",
			"dates": {
				"composed": 1761
			},
			"catalog": [
				{
					"scheme": "hob",
					"number": "i:10"
				}
			]
		}
	],
	"key": "D",
	"form": "symphony",
	"movements": [
		{
			"title": "Allegro"
		},
		{
			"title": "Andante",
			"key": "G"
		},
		{
			"title": "Presto"
		}
	],
	"xref": {
		"mb": "68395e09-c275-42eb-81e5-5f51e2cbb45b"
	}
}
