{
	"id": "9d5d7757",
	"attribution": [
		{
			"composer": "mozart",
			"dates": {"composed": 1776},
			"catalog": [{"scheme": "k", "edition": "1", "number": "244", "since": "1862"}]
		}
	],
	"key": "F",
	"form": "church sonata",
	"instrumentation": "2 violins, organ, cello and bass",
	"movements": [
		{
			"title": "Allegro"
		}
	]
}
