{
	"id": "3d28001a",
	"title": {
		"de": "Was frag ich nach der Welt"
	},
	"attribution": [
		{
			"composer": "bach",
			"dates": {
				"premiered": 1724
			},
			"catalog": [
				{
					"scheme": "bwv",
					"number": "94"
				}
			]
		}
	],
	"form": "chorale cantata",
	"instrumentation": "soprano, alto, tenor, bass, choir (SATB), flauto traverso, 2 oboes, 2 violins, viola, organ, continuo",
	"note": "Composed for the Ninth Sunday after Trinity.",
	"movements": [
		{
			"title": "Was frag ich nach der Welt",
			"form": "chorale"
		},
		{
			"title": "Die Welt ist wie ein Rauch und Schatten",
			"form": "aria",
			"soloists": "bass"
		},
		{
			"title": "Die Welt sucht Ehr und Ruhm",
			"form": "recitative and chorale",
			"soloists": "tenor"
		},
		{
			"title": "Betörte Welt, betörte Welt!",
			"form": "aria",
			"soloists": "alto"
		},
		{
			"title": "Die Welt bekümmert sich",
			"form": "recitative and chorale",
			"soloists": "bass"
		},
		{
			"title": "Die Welt kann ihre Lust und Freud",
			"form": "aria",
			"soloists": "tenor"
		},
		{
			"title": "Es halt es mit der blinden Welt",
			"form": "aria",
			"soloists": "soprano"
		},
		{
			"title": "Was frag ich nach der Welt!",
			"form": "chorale"
		}
	],
	"xref": {
		"wp": "BWV_94",
		"mb": "acaa5fbd-0ea1-44d6-a393-468247123e69"
	}
}
