{
	"id": "9fc6398b",
	"attribution": [
		{
			"composer": "haydn",
			"dates": {
				"composed": 1778
			},
			"catalog": [
				{
					"scheme": "hob",
					"number": "i:65"
				}
			]
		}
	],
	"key": "A",
	"form": "symphony",
	"movements": [
		{
			"title": "Vivace e con spirito"
		},
		{
			"title": "Andante"
		},
		{
			"title": "Menuetto and Trio"
		},
		{
			"title": "Finale: Presto"
		}
	],
	"xref": {
		"mb": "aa61396f-b35c-4bc9-be7c-f21113db5f08"
	}
}
