{
	"id": "b0dc0ca9",
	"attribution": [
		{
			"composer": "beethoven",
			"dates": {
				"composed": 1808,
				"premiered": 1808
			},
			"catalog": [
				{
					"scheme": "op",
					"number": "67"
				}
			]
		}
	],
	"key": "c",
	"form": "symphony",
	"movements": [
		{
			"title": "Allegro con brio"
		},
		{
			"title": "Andante con moto",
			"key": "Ab"
		},
		{
			"title": "Scherzo: Allegro"
		},
		{
			"title": "Allegro – Presto",
			"key": "C"
		}
	]
}