{
	"id": "ab1d846e",
	"attribution": [
		{
			"composer": "haydn",
			"dates": {
				"composed": 1767
			},
			"catalog": [
				{
					"scheme": "hob",
					"number": "i:58"
				}
			]
		}
	],
	"key": "F",
	"form": "symphony",
	"movements": [
		{
			"title": "Allegro"
		},
		{
			"title": "Andante"
		},
		{
			"title": "Menuet alla zoppa - Trio: Un poco allegretto"
		},
		{
			"title": "Finale: Presto"
		}
	],
	"xref": {
		"mb": "f0bd0490-afb7-496b-ba8a-455617d7a563"
	}
}
