{
	"id": "14aab36c",
	"title": {
		"de": "Himmelskönig, sei willkommen"
	},
	"attribution": [
		{
			"composer": "bach",
			"dates": {
				"premiered": 1714
			},
			"catalog": [
				{
					"scheme": "bwv",
					"number": "182"
				}
			]
		}
	],
	"form": "church cantata",
	"instrumentation": "alto, tenor, bass, four-part choir, recorder, 2 violins, 2 violas, basso continuo",
	"note": "Composed for Palm Sunday.",
	"movements": [
		{
			"title": "Sonata"
		},
		{
			"title": "Himmelskönig, sei willkommen",
			"form": "chorus"
		},
		{
			"title": "Siehe, ich komme, im Buch ist von mir geschrieben",
			"form": "recitative",
			"soloists": "bass"
		},
		{
			"title": "Starkes Lieben",
			"form": "aria",
			"soloists": "bass"
		},
		{
			"title": "Leget euch dem Heiland unter",
			"form": "aria",
			"soloists": "alto"
		},
		{
			"title": "Jesu, laß durch Wohl und Weh",
			"form": "aria",
			"soloists": "tenor"
		},
		{
			"title": "Jesu, deine Passion ist mir lauter Freude",
			"form": "chorale"
		},
		{
			"title": "So lasset uns gehen in Salem der Freuden",
			"form": "chorus"
		}
	],
	"xref": {
		"wp": "BWV_182",
		"mb": "b37b3609-3871-4637-972f-0a5801a1e73d"
	}
}
