{
	"id": "8d5f2a9c",
	"attribution": [
		{
			"catalog": [
				{
					"scheme": "bwv",
					"number": "1012"
				}
			],
			"composer": "bach",
			"dates": {
				"composed": 1723
			}
		}
	],
	"form": "suite",
	"instrumentation": "cello",
	"key": "D",
	"movements": [
		{
			"title": "Prelude"
		},
		{
			"title": "Allemande"
		},
		{
			"title": "Courante"
		},
		{
			"title": "Sarabande"
		},
		{
			"title": "Gavotte I"
		},
		{
			"title": "Gavotte II"
		},
		{
			"title": "Gigue"
		}
	],
	"xref": {
		"oo": "9964",
		"wp": "BWV_1012",
		"mb": "d2bf3bb3-c898-4c31-bd7d-1c26aace49e4"
	}
}
