{
	"id": "0514e021",
	"attribution": [
		{
			"composer": "beethoven",
			"dates": {
				"composed": 1800,
				"published": 1801
			},
			"catalog": [
				{
					"scheme": "op",
					"number": "18/5"
				}
			]
		}
	],
	"key": "A",
	"form": "string quartet",
	"movements": [
		{
			"title": "Allegro"
		},
		{
			"title": "Menuetto - Trio"
		},
		{
			"title": "Andante cantabile",
			"key": "D"
		},
		{
			"title": "Allegro assai"
		}
	]
}