{
	"id": "ae472e78",
	"attribution": [
		{
			"composer": "mozart",
			"dates": {"composed": 1778},
			"catalog": [
				{"scheme": "k", "edition": "9", "number": "304", "since": "2024"},
				{"scheme": "k", "edition": "6", "number": "300c", "since": "1964"},
				{"scheme": "k", "edition": "1", "number": "304", "since": "1862"}
			]
		}
	],
	"key": "e",
	"form": "sonata",
	"instrumentation": "violin and piano",
	"movements": [
		{
			"title": "Allegro"
		},
		{
			"title": "Tempo di Menuetto"
		}
	]
}
