{
	"id": "20463eb0",
	"title": {
		"de": "Schauet doch und sehet, ob irgendein Schmerz sei"
	},
	"attribution": [
		{
			"composer": "bach",
			"dates": {
				"premiered": 1723
			},
			"catalog": [
				{
					"scheme": "bwv",
					"number": "46"
				}
			]
		}
	],
	"form": "sacred cantata",
	"key": "C",
	"instrumentation": "SATB soloists, SATB choir, 2 oboes, taille (oboe da caccia), 2 violins, viola, continuo",
	"note": "",
	"movements": [
		{
			"title": "Schauet doch und sehet, ob irgendein Schmerz sei",
			"form": "chorus"
		},
		{
			"title": "So beklagt sich die gekränkte Liebe",
			"form": "recitative"
		},
		{
			"title": "Dein Exempel kann mich schrecken",
			"form": "aria"
		},
		{
			"title": "Doch Jesus will auch bei der Strafe",
			"form": "recitative"
		},
		{
			"title": "Jesus macht es wieder gut",
			"form": "aria"
		},
		{
			"title": "Ertöt uns durch dein Güte",
			"form": "chorale"
		}
	],
	"xref": {
		"wp": "BWV_46",
		"mb": "2b6314d2-8ac6-4d9e-b4d7-8e9668937b38"
	}
}
