{
	"id": "dbb0a49d",
	"attribution": [
		{
			"composer": "mozart",
			"dates": {"composed": 1772},
			"catalog": [
				{"scheme": "k", "edition": "9", "number": "67", "since": "2024"},
				{"scheme": "k", "edition": "6", "number": "41h", "since": "1964"},
				{"scheme": "k", "edition": "1", "number": "67", "since": "1862"}
			]
		}
	],
	"key": "Eb",
	"form": "church sonata",
	"instrumentation": "2 violins, organ, cello and bass",
	"movements": [
		{
			"title": "Andantino"
		}
	]
}
