{
	"id": "e3bb2785",
	"title": {
		"de": "Ich bin vergnügt mit meinem Glücke"
	},
	"attribution": [
		{
			"composer": "bach",
			"dates": {
				"composed": 1727,
				"premiered": 1727
			},
			"catalog": [
				{
					"scheme": "bwv",
					"number": "84"
				}
			]
		}
	],
	"form": "solo cantata",
	"instrumentation": "soprano, SATB choir (chorale only), oboe, 2 violins, viola, continuo",
	"note": "Composed for the Sunday Septuagesima.",
	"movements": [
		{
			"title": "Ich bin vergnügt mit meinem Glücke",
			"form": "aria",
			"soloists": "soprano",
			"key": "e"
		},
		{
			"title": "Gott ist mir ja nichts schuldig",
			"form": "recitative",
			"soloists": "soprano"
		},
		{
			"title": "Ich esse mit Freuden mein weniges Brot",
			"form": "aria",
			"soloists": "soprano",
			"key": "G"
		},
		{
			"title": "Im Schweiße meines Angesichts",
			"form": "recitative",
			"soloists": "soprano"
		},
		{
			"title": "Ich leb indes in dir vergnüget",
			"form": "chorale",
			"key": "e"
		}
	],
	"xref": {
		"wp": "BWV_84",
		"mb": "62fde156-1143-4a97-a0b6-4bb9552ac3fa"
	}
}
