{
	"id": "a42348c4",
	"attribution": [
		{
			"composer": "mozart",
			"dates": {"composed": 1777, "published": 1782},
			"catalog": [{"scheme": "k", "number": "311"}]
		}
	],
	"key": "D",
	"form": "sonata",
	"instrumentation": "piano",
	"movements": [
		{
			"title": "Allegro con spirito"
		},
		{
			"title": "Andantino con espressione",
			"key": "G"
		},
		{
			"title": "Rondeau (Allegro)"
		}
	],
	"xref": {
		"oo": "23354",
		"wp": "Piano_Sonata_No._9_(Mozart)"
	}
}
