{
	"id": "1357dcd0",
	"attribution": [
		{
			"composer": "mozart",
			"dates": {"composed": 1777},
			"catalog": [
				{"scheme": "k", "edition": "9", "number": "309", "since": "2024"},
				{"scheme": "k", "edition": "6", "number": "284b", "since": "1964"},
				{"scheme": "k", "edition": "1", "number": "309", "since": "1862"}
			]
		}
	],
	"key": "C",
	"form": "sonata",
	"instrumentation": "piano",
	"movements": [
		{
			"title": "Allegro con spirito"
		},
		{
			"title": "Andante un poco adagio",
			"key": "F"
		},
		{
			"title": "Rondo (allegretto grazioso)"
		}
	],
	"xref": {
		"oo": "23712",
		"wp": "Piano_Sonata_No._7_(Mozart)"
	}
}
