{
	"id": "47eea42c",
	"attribution": [
		{
			"composer": "schubert",
			"dates": {
				"composed": 1818
			},
			"catalog": [
				{
					"scheme": "d",
					"number": "608"
				}
			]
		}
	],
	"key": "D",
	"form": "rondo",
	"instrumentation": "piano four-hands",
	"xref": {
		"mb": "ed06d969-984d-445d-9fd6-4e971b1effa2"
	}
}
