{
	"id": "a8c204db",
	"attribution": [
		{
			"composer": "schubert",
			"dates": {
				"composed": 1822
			},
			"catalog": [
				{
					"scheme": "d",
					"number": "760"
				},
				{
					"scheme": "op",
					"number": "15"
				}
			]
		}
	],
	"key": "C",
	"form": "fantasy",
	"instrumentation": "piano",
	"movements": [
		{
			"title": "Allegro con fuoco ma non troppo"
		},
		{
			"title": "Adagio"
		},
		{
			"title": "Presto"
		},
		{
			"title": "Allegro"
		}
	],
	"xref": {
		"mb": "40f46c9e-a64f-3e4e-bbdd-27a1ead8503a"
	}
}
