{
	"id": "debef575",
	"title": {
		"de": "Sie werden euch in den Bann tun"
	},
	"attribution": [
		{
			"composer": "bach",
			"dates": {
				"premiered": 1724
			},
			"catalog": [
				{
					"scheme": "bwv",
					"number": "44"
				}
			]
		}
	],
	"form": "church cantata",
	"instrumentation": "soprano, alto, tenor, bass, choir (SATB), 2 oboes, 2 violins, viola, continuo",
	"note": "Composed for Exaudi, the Sunday after Ascension.",
	"movements": [
		{
			"title": "Sie werden euch in den Bann tun",
			"form": "duet",
			"soloists": "tenor, bass",
			"key": "g"
		},
		{
			"title": "Es kömmt aber die Zeit",
			"form": "chorus",
			"key": "g"
		},
		{
			"title": "Christen müssen auf der Erden",
			"form": "aria",
			"soloists": "alto",
			"key": "c"
		},
		{
			"title": "Ach Gott, wie manches Herzeleid",
			"form": "chorale",
			"soloists": "tenor"
		},
		{
			"title": "Es sucht der Antichrist",
			"form": "recitative",
			"soloists": "bass"
		},
		{
			"title": "Es ist und bleibt der Christen Trost",
			"form": "aria",
			"soloists": "soprano",
			"key": "Bb"
		},
		{
			"title": "So sei nun, Seele, deine",
			"form": "chorale",
			"key": "Bb"
		}
	],
	"xref": {
		"wp": "BWV_44",
		"mb": "74bf5976-6f92-45f1-981c-7375e78e8e01"
	}
}
