{
	"id": "c6293f83",
	"title": {
		"de": "Nimm von uns, Herr, du treuer Gott"
	},
	"attribution": [
		{
			"composer": "bach",
			"dates": {
				"premiered": 1724
			},
			"catalog": [
				{
					"scheme": "bwv",
					"number": "101"
				}
			]
		}
	],
	"form": "chorale cantata",
	"instrumentation": "soprano, alto, tenor, bass, choir (SATB), cornett, 3 trombones, 2 oboes, oboe da caccia, taille, flauto traverso, 2 violins, viola, basso continuo",
	"note": "Composed for the tenth Sunday after Trinity.",
	"movements": [
		{
			"title": "Nimm von uns, Herr, du treuer Gott",
			"form": "chorale fantasia",
			"key": "d"
		},
		{
			"title": "Handle nicht nach deinen Rechten",
			"form": "aria",
			"soloists": "tenor",
			"key": "g"
		},
		{
			"title": "Ach! Herr Gott, durch die Treue dein",
			"form": "chorale and recitative",
			"soloists": "soprano",
			"key": "g"
		},
		{
			"title": "Warum willst du so zornig sein?",
			"form": "aria",
			"soloists": "bass",
			"key": "a"
		},
		{
			"title": "Die Sünd hat uns verderbet sehr",
			"form": "chorale and recitative",
			"soloists": "tenor",
			"key": "d"
		},
		{
			"title": "Gedenk an Jesu bittern Tod",
			"form": "aria",
			"soloists": "soprano, alto",
			"key": "d"
		},
		{
			"title": "Leit uns mit deiner rechten Hand",
			"form": "chorale",
			"key": "d"
		}
	],
	"xref": {
		"wp": "BWV_101",
		"mb": "d9c9f554-e316-4fb5-956d-bf994f00cca5"
	}
}
