{
	"id": "7c2e9b4f",
	"attribution": [
		{
			"catalog": [
				{
					"scheme": "bwv",
					"number": "852"
				}
			],
			"composer": "bach",
			"dates": {
				"composed": 1722
			}
		}
	],
	"form": "prelude and fugue",
	"instrumentation": "keyboard",
	"key": "Eb",
	"movements": [
		{
			"title": "Prelude"
		},
		{
			"title": "Fugue"
		}
	],
	"xref": {
		"oo": "9781",
		"wp": "BWV_852",
		"mb": "56983eba-c55c-347a-830d-af1781f7fe79"
	}
}
